title, applied to, link, outcome,
Data Scientist, BBC, https://careers.bbc.co.uk/job/Data-Scientist/31040-en_GB, rejected,
Data Scientist, Slalom, https://jobs.slalom.com/?src=a121R00000NSLLRQA5#/post/a0hPh0000040b0T, applied,
Senior Research Data Scientist, dunnhumby, https://job-boards.greenhouse.io/dunnhumby/jobs/6354666003, rejected,
Senior Programmer and Data Manager, Ricardo, https://careers-ricardo.icims.com/jobs/3147/senior-programmer-and-data-manager/candidate?from=login&csrf=2B2DBA98FBB963C7&hashed=-626006868&uploadResume=1&uploadResume=1, applied,
AI/ML Engineer, Forge Holiday Group, https://careers.forgeholidays.com/job/764826, rejected,
Math Software Developer, Light & Wonder, https://lnw.wd5.myworkdayjobs.com/en-US/LightWonderExternalCareers/login, rejected,
Graduate Software Engineer, Ashton Fire, https://ashtonfire.bamboohr.com/careers/50, rejected,
Data Consultant, WSP, https://emit.fa.ca3.oraclecloud.com/hcmUI/CandidateExperience/fr-CA/sites/CX_2001/job/73871/?mode=location, applied, 
Mid Software Developer, Bentley Systems,https://career4.successfactors.com/portalcareer?_s.crb=H2fNdhGOn0ge2cdXhZH4HFYO4%252bhwC%252bhIX882uqKbh4c%253d,rejected 
ML Engineer, Netflix, https://explore.jobs.netflix.net/careers/search?query=%2A&pid=790303496227&domain=netflix.com&sort_by=relevance, rejected,
Quantitative Researcher, Fuse Energy (Dubai), https://www.linkedin.com/jobs/search-results/?currentJobId=4231733769&eBP=NOT_ELIGIBLE_FOR_CHARGING&keywords=python%20developer&refId=ZbH3%2Bpr%2BqUzocguTYHAM0A%3D%3D&start=25&trackingId=JKz8p0XHd9p0DiL1rUUA6Q%3D%3D, ghosted,
Reply Cortex, Graduate AI Software Engineer, https://career5.successfactors.eu/portalcareer?_s.crb=AoMGz8mNnD%252fpU8sI76K9lg12i5HckWdEMgdveNANst4%253d, ghosted,
Full Stack AI Developer, JP Morgan Chase, https://... , rejected,
Senior Data Scientist, Monzo, https://... , rejected,
Assistant Manager (Model Validation Quant), Lloyds Banking Group, https://www.lloydsbankinggroup.com/careers/job-search/workday-job.148001.html, rejected
ML Engineer, Robert Walters Recruitment agency, https://www.robertwalters.co.uk/technologydigital/jobs/datascienceairesearch/1871864-machine-learning-engineer.html, applied
TypeForm, Sr. Machine Learning Enigneer, https://job-boards.greenhouse.io/typeform/jobs/7446908, applied
SignifyTechnologies, Deep Learning Engineer, https://www.signifytechnology.com/jobs/Deep-Learning-Engineer-19756/ , applied
AJ Bell, Software Developer, https://www.ajbell.co.uk/group/careers/vacancies/744000099333780, rejected
Sky, Senior Developer - AI Operations (Python/Golang), https://sky.talent-community.com/app/project/62497?type=app_flow, rejected
University of Warwick, Research Software Engineer, https://warwick-careers.tal.net/vx/lang-en-GB/mobile-0/appcentre-1/brand-4/user-11595/xf-1d744d0612b7/candidate/so/pm/1/pl/3/opp/3820-Research-Software-Engineer-111083-0226/en-GB, rejected
University of Glasgow, Research Assistant, https://www.jobs.gla.ac.uk/job/research-associate-5819959?source=gla.ac.uk, rejected
JPM, Applied AI Associate, https://jpmc.fa.oraclecloud.com/hcmUI/CandidateExperience/en/sites/CX_1001/jobs/preview/210708261/?keyword=associate&location=GLASGOW%2C+LANARKSHIRE%2C+United+Kingdom&locationId=300000057008413&locationLevel=city&mode=location&radius=25&radiusUnit=MI, rejected
University of Glasgow, Research Software Engineer, https://www.jobs.gla.ac.uk/job/research-software-engineer-2-positions-5831177?source=gla.ac.uk, rejected
AJ Bell, Software Developer, https://www.linkedin.com/jobs/search/?alertAction=viewjobs&currentJobId=4382083434&distance=25&f_TPR=a1773141001-&f_WT=1%2C3&geoId=105082928&keywords=software%20engineer&origin=JOB_ALERT_IN_APP_NOTIFICATION&originToLandingJobPostings=4382083434%2C4382099149%2C4383762510%2C4382430557%2C4382088285%2C4365488370&savedSearchId=8459452338&sortBy=R, rejected
Lloyds Banking Group, Data & AI Engineer, https://lbg.wd3.myworkdayjobs.com/en-US/LBG_Careers/job/Data---AI-Scientist_153277-2, applied
Tek Systems, Ai Platform Engineer, https://careers.teksystems.com/gb/en/job/JP-005883424/Ai-Platform-Engineer?utm_source=LinkedIn_Slots&utm_medium=equest&s_id=LinkedIn, rejected
Senior Python ML Engineer, mthree, https://www.linkedin.com/jobs/search-results/?currentJobId=4383214753&eBP=NON_CHARGEABLE_CHANNEL&refId=OV1qlQwda94%2BfQDbb%2Fb4Pg%3D%3D&trackingId=cspqZ7dYk5ctT4VvXEQqZA%3D%3D&keywords=python%20jobs%20in%20glasgow&origin=BLENDED_SEARCH_RESULT_NAVIGATION_SEE_ALL&originToLandingJobPostings=4379902453%2C4383214753%2C4380341444, rejected
Software Developer, Aspen Technology, https://aspentech.wd5.myworkdayjobs.com/en-US/aspentech/userHome, applied
Agentic / GenAI / Senior Consultant, Capgemini, https://www.consultancy.uk/jobs/52123/capgemini-invent/agentic-genai-consultant-senior-consultant, applied
Software Engineer, Skyridge,https://skyridgecorp.zohorecruit.ca/jobs/Careers/5451000001476999/Software-Engineer?source=LinkedIn-Premium, applied
Software Engineer, NatWest Group, https://rbs.wd3.myworkdayjobs.com/en-US/RBS/job/Software-Engineer_R-00272410-1, applied
Python Developer, Robert Walters, https://www.aplitrak.com/?adid=TWljaGFlbGxlLk9ibmlhbC4yNDYwNS4xNTUwQGdzY21hbmNoZXN0ZXJ0ZXQuYXBsaXRyYWsuY29t, applied
Applied AI ML - Python & Agentic AI, JPMorganChase, https://jpmc.fa.oraclecloud.com/hcmUI/CandidateExperience/en/sites/CX_1001/my-profile/preview/210730468, rejected
Vertex AI Engineer, Deloitte, https://deloitte.zohorecruit.eu/jobs/Careers/43151000022937449/Vertex-AI-Engineer?source=CareerSite, applied
Staff Software ML Engineer, ARM, https://careers.arm.com/job/cambridge/staff-software-ml-engineer/33099/93485592144, rejected
Experienced Software Engineer Java/Python (Full stack or Backend), JPMorganChase, https://jpmc.fa.oraclecloud.com/hcmUI/CandidateExperience/en/sites/CX_1001/my-profile/preview/210670013, applied
Analyst - Quantitative Research, ICE, https://globalcareers-ice.icims.com/jobs/12154/analyst%2c-quantitative-research/job?mode=submit_apply, rejected
Software Engineer (Developer Experience), UserTesting, https://usertesting.wd12.myworkdayjobs.com/UserTesting/job/Edinburgh/Software-Engineer-II_R-101107?source=LinkedIn, applied
Senior AI/ML Engineer, Salford City Council, https://www.greater.jobs/en-gb/job/75798632, applied
Research Software Engineer, The Rosalind Franklin Institute, https://opportunities.rfi.ac.uk/vacancy/research-software-engineer-609304.html#hs_show_apply_popup=true, rejected
Research Software Engineer, University of Southampton, https://www.jobs.ac.uk/job/DQY859/software-engineer-senior-software-engineer, applied
Senior Fullstack Developer, Robert Half, https://www.roberthalf.com/gb/en/job/manchester-greater-manchester/senior-fullstack-developer-python/06010-0013422535-uken?ref_=rh_ja, applied
AI Engineer, Xelix, https://careers.xelix.com/jobs/7455094-ai-engineer, applied
AI Engineer, Capstone Investment Advisors, https://job-boards.greenhouse.io/capstoneinvestmentadvisors/jobs/8535978002?gh_src=kmgtkc3o2us, applied
Software Engineer - Go, Paddle, https://jobs.ashbyhq.com/paddle/de7ac3e5-16db-4a59-989d-5e7840b019b6, rejected
Backend Engineer (AI), TeamTailor, https://nplan.teamtailor.com/jobs/7722963-backend-engineer-ai, applied
Associate Applied AI & ML Scientist – Markets Operations, JPM, https://jpmc.fa.oraclecloud.com/hcmUI/CandidateExperience/en/sites/CX_1001/my-profile/preview/210685435, rejected
NLP / LLM Scientist - Applied AI ML Lead - Machine Learning Centre of Excellence, JPM, https://jpmc.fa.oraclecloud.com/hcmUI/CandidateExperience/en/sites/CX_1001/my-profile/preview/210667160, reject
Data Scientist, bet365, https://user.hackajob.com/apply/2dd138f1-4fbf-11f1-a7b8-0a05e249917d, applied
Senior Research Officer, University of Liverpool, https://jobs.soton.ac.uk/Logon/default.aspx?ReturnUrl=%2fOrg%2fApp%2fStepRefsEdit.aspx, applied
AI Data Scientist, RevWire (University of Essex), https://vacancies.essex.ac.uk/tlive_webrecruitment/wrd/run/ETREC179GF.open?WVID=9918109NEm, applied
Data Scientist, bet365, https://jobs.smartrecruiters.com/oneclick-ui/company/Bet3651/publication/b2ce9a86-05a2-40e8-b391-a8554f5cc54c/success?dcr_ci=Bet3651&sid=ef954459-be04-4d09-912d-39408e61ae36, applied
GenAI AI Python Engineer, Citi, https://jobs.citi.com/job/-/-/287/93271395088?source=APPLICANT_SOURCE-3-354&utm_medium=job_posting&utm_campaign=emea_experienced&utm_content=social_media&utm_term=393708536&ss=paid&utm_source=linkedin, rejected
Full Stack Developer (Java / Python / Go), Deloitte, https://deloitte.zohorecruit.eu/jobs/Careers/43151000024266834/Full-Stack-Developer-?-Public-Cloud-Infrastructure-as-Code?source=CareerSite, applied
Python Developer, Version 1, https://www.linkedin.com/jobs/search-results/?currentJobId=4352311143&eBP=CwEAAAGeyraX3bc0OklQQeBJc5ViVuV06FtdMn_bx0bOQRkCP3ralAFSN3_1TMPlCgYVcubd1s-oHhxIu-cc4vTLLuMn34zA7gBOQLX2a6ltiFRs6VUTvRV6MEAsXkoqc1BQcBPg42Ar7pXPoP_vHULTWZZGOFqf3lNlZJqQqnRbbDS1X0g3KfyNlxVAxYOCh12uoU2IYb9r3GuO-UPzDQxAl7UZQnooDl1VwmJgKrTkx0G0MC-R6rl5vC8kpWoGQxlW18dU4NOIaXQuSFUcC4r32df8HIt0FWEZLLaT5uFUATiQ2ujoPrO5EuQrDbHovpUKvzUAvMLaSuf13SGLKK5ewoorjVhqv6Z9ws_E3QjuN2jGpo75Jsx-mWFF_oj4cE-7AfPspC7Y-u09n1ki5ddfTd7ql2Tpt19oldB2INKJLMFeV1YkL1FvBtA1ZnPdIvJocwDE0Dhc78L4MQqMiLDwPnLSFdUCjXQa41tkMQk&refId=shfVxwAasRcOrRx4MmNSbQ%3D%3D&trackingId=KVma%2B3JJGpODU1bAaKdhSg%3D%3D&keywords=python%20jobs%20in%20belfast&origin=JOB_SEARCH_PAGE_JOB_FILTER&referralSearchId=iEz8RC%2BQFUNBQqgVww9eVA%3D%3D&f_TPR=r604800, applied
Python Developer, Citi Bank Group, https://jobs.citi.com/job/-/-/287/93754504192?source=APPLICANT_SOURCE-3-354&ss=paid, rejected
Consultant Applied AI Engineer, EY Consulting, https://careers.ey.com/ey/job/London-Senior-Consultant-Applied-AI-Engineer%2C-TC-E14-5EY/1382046133/?feedId=337401, applied
Python Software Engineer, Instill, https://jobs.ashbyhq.com/instil/0dbf7888-1d50-432a-86b4-69c408445ee7, applied
Market Risk Engineer Developer, Lloyds Banking Group, https://lbg.wd3.myworkdayjobs.com/broadbean_external/job/Edinburgh/Market-Risk-Engineering-Developer_158275-3?source=linkedin, applied
Credit Stress Testing Analytics Manager, NatWest Group, https://jobs.natwestgroup.com/jobs/17286145-credit-stress-testing-analytics-manager?tm_job=R-00272168-OTHLOC-GBR-5FEDI034&tm_event=view&tm_company=861&bid=56, applied
Markets Data Scientist, FCA,https://fca.wd3.myworkdayjobs.com/en-US/FCA_Careers/job/Markets-Data-Scientist_JR0021745-1, applied
Junior Analyst, Edinburgh Airport, https://jobs.edinburghairport.com/vacancies/789/junior-analyst.html, applied
Data Scientist, Icon Strategic Solutions, https://careers.iconplc.com/job/data-scientist-in-uk-livingston-jid-51398?_atxsrc=LinkedInSS&source=LinkedInSS, applied
Senior AI Engineer, Capco, https://job-boards.greenhouse.io/capco/jobs/7908876?gh_src=h27x80rp1us, applied
Software Engineer, Lloyds Banking Group, https://lbg.wd3.myworkdayjobs.com/broadbean_external/job/London/Software-Engineer_157337-2?source=linkedin, applied
Full Stack Software Engineer (Python / React), PWC, https://jobs.pwc.co.uk/uk/en/job/PUDPUNUK719892WDEXTERNALENUK/Full-Stack-Engineer-Python-and-React, applied
Senior Python Developer, Citadel Securities, https://www.citadelsecurities.com/careers/details/senior-python-software-engineer/, applied
Senior Specialist OPS Data Transfer Integration and Quality, BNY Melon, https://eofe.fa.us2.oraclecloud.com/hcmUI/CandidateExperience/en/sites/BNY-Careers/my-profile/preview/72010, applied
Software Engineer (Python - AI platform), Revolut UK, https://www.revolut.com/careers/apply/f00b3d8e-2c9a-4af6-86ee-644dbf8b6bc6/, rejected
Software Engineer, Amazon UK, https://www.amazon.jobs/en-gb/jobs/10408763/software-development-engineer-2026, applied
Software Engineer, Motorolla Solutions, https://motorolasolutions.wd5.myworkdayjobs.com/en-US/Careers/job/Edinburgh-UK-ZUK129/Junior-Back-End-Engineer_R65538/apply/autofillWithResume?source=LinkedIn, applied
Vertex AI Engineer, Deloitte, https://deloitte.zohorecruit.eu/jobs/Careers/43151000022937449?source=Linkedin, applied
AI Engineer, Version 1, https://jobs.smartrecruiters.com/Version1/744000133887020-ai-engineer?trid=2d92f286-613b-4daf-9dfa-6340ffbecf73, applied
AI Engineer, Vertu Careers, https://jobs.vertucareers.com/Forms/Application?formParameters=KizGpaAy2eXCe2joHs%2FLflkvlM2M74p%2F7fCE30f4V6pbSts4074o5g%3D%3D&jobPostId=862816, applied
Junior Software & System Engineer, Worknest, https://securecareers.worknest.com/jobs/7971678-junior-software-systems-engineer, applied
Machine Learning Engineer, PWC, https://jobs.pwc.co.uk/uk/en/job/PUDPUNUK710133WDEXTERNALENUK/Machine-Learning-Engineer, applied
Full Stack Engineer, PWC, https://jobs.pwc.co.uk/uk/en/job/719892WD/Full-Stack-Engineer-Python-and-React, rejected
MLOps Engineer, HSBC UK, https://portal.careers.hsbc.com/careers?pid=563774611486173&domain=hsbc.com, applied
Software ML Engineer, Arm, https://careers.arm.com/job/manchester/software-ml-engineer/33099/93485591936, applied
Mid Level Full Stack Developer, UK Biobank, https://www.linkedin.com/jobs/search-results/?currentJobId=4415317949&eBP=CwEAAAGfErikRGfrlqIBLm6BojmmAKXp8Xs8HGzrPtD7rTgP6krFj4fVZh9fg0YN8XXQAjg3kcSiGvuiMBtR2tkdOtNT-xreLI68gl5hifwqSVvCgb0a1qKrJXe17OklKsaOCYlPFCsdB74_HWVbWauiIZ5v-KSrIIw7uJDqkuZnJVuZZQFFY-C9uyXWMveHZahKbl5rWtYSKlPyamb6_sTYucrb497LttdU6Pakd9S1KI58Mcvk0q6sKjoF3XMZyis8-CcCnY5sTxUbaXTp2Mh9GdvKqBNw8JRSKZnDflaLYaCO5p-rvT5LWXSg5KT4vUS24Ek7iZ1PV-6dRzg323xxn1bntFDaRI731WkZkpIlC_NkqEcMlXa2WkZOFj7aUwCLbacqBaiLQPKM6ybzFh1fRUu9OTixFpDsIDnF_BL0zOE67xlTRyW9e-OXKdb4X0C4QFw7LqWAQoD8GoKbRUjUs21HkzK86IFdxUJl9uZxmqCajrQ&refId=4UIhLoy6Et9k3CY7IEZs9Q%3D%3D&trackingId=I62P24ejhjxw2vV90gdjrg%3D%3D&keywords=software%20developer%20jobs%20in%20leeds&origin=JOB_SEARCH_PAGE_JOB_FILTER&referralSearchId=GOWQUdeK7CzJwZ3JmcsX3g%3D%3D&f_TPR=r604800, applied
AI Engineer (AIX), OVO Energy, https://careers.ovo.com/ai-engineer-aix/7699829?gh_src=c12f74a61us, applied
Software Engineer (Backend), Symphony, https://www.linkedin.com/jobs/search-results/?currentJobId=4433857035&eBP=CwEAAAGfEvQZVHTWig0PDj7mJY-FCmOT2PBsudp0SzTqr-XlzaptDb-JR-N37CBrPw-7AY-MX10YCEOorJ3LlJ_19RDKuZhhPW5eR3g9L_r5ghnOJ-9MoqwOCdjJ3mp941_h8hahLF0Kj1lNXVajSE6TI4pzKXkSId-TWL1gdmCQ6CatfJC0DFErQo4cW0uLV1wA8Jt0VJVzFn-_WSQiATLon4vAeKEx1pUFnuwuCAgDHM-wcqeeWU1j38FttS2okcBaZ9MssXF4Am94wASYGiFBjh1MVoKoL2dEyTpyvr4VQN0Ykd8NJrK1ImBbekSGKyxQ4dsD7_z2Boi6l6KnVs68aUigOXjCiJdPwnvhYxQ0IBTYyyuHJ-OE3-D6DUjq6EgVNRXw1p0dZBAaB38Be10b2_40OVCa8Wz1q-bHg4T7CYX7tXlNl5AODyQ7DwOymi8HtqYt3CApDLqIWP2dZxi663cXdPATpsTF8LQRZgBG_g&refId=%2BWEXBjTtj7vMXwNvLP7w2w%3D%3D&trackingId=sdQtvEx0%2BYUZNgUjcn5YvQ%3D%3D&keywords=software%20developer%20jobs%20in%20belfast%20posted%20in%20the%20past%20week&origin=SEMANTIC_SEARCH_LANDING_PAGE, applied

